{
  "schema_version": "v35.source_snapshot_manifest.v1",
  "source_id": "hopv15",
  "dataset_doi": "10.6084/m9.figshare.1610063.v4",
  "dataset_version": "figshare-v4-fixture",
  "retrieved_at": "2026-07-17T00:00:00+00:00",
  "source_url": "https://doi.org/10.6084/m9.figshare.1610063.v4",
  "license_hint": "CC-BY-4.0",
  "required_citation": "HOPV15 Harvard Organic Photovoltaic Dataset; cite the Scientific Data publication and Figshare record.",
  "files": [
    {
      "relative_path": "records.json",
      "bytes": 328,
      "sha256": "cb31a285796d02b9f84aeeecc9471306ec49ce136a9608ee4beb65f3518b0222",
      "role": "normalized_records"
    }
  ],
  "importer": {
    "name": "hopv15_fixture_importer",
    "version": "v35.p0",
    "normalizer_version": "hopv15-normalizer-v1"
  },
  "normalized_record_count": 1,
  "quarantine_status": "fixture_only",
  "notes": "Minimal local fixture for offline provider tests; not the full HOPV15 dump."
}
